[
  {
    "id": "ext.chemlab.reaction-sandbox",
    "provider": "chem-lab-station",
    "mode": "reference",
    "status": "active",
    "title": "Reaction Sandbox",
    "description": "Reagentlarni tanlash, aralashtirish, qizdirish va kuzatuvlarni solishtirish uchun tashqi sandbox.",
    "learningUnitIds": ["lu.8.14", "lu.9.05", "lu.11.19", "lu.11.20"],
    "externalUrl": "https://chemlaboratory.vercel.app/",
    "evidencePolicy": "none",
    "localAssessmentRequired": true
  },
  {
    "id": "ext.chemlab.acid-base",
    "provider": "chem-lab-station",
    "mode": "reference",
    "status": "active",
    "title": "Acid–Base / pH Sandbox",
    "description": "Kislota-asos reaksiyalari va pH kuzatuvlarini qo‘shimcha sandboxda tekshirish.",
    "learningUnitIds": ["lu.7.20", "lu.9.03", "lu.9.06", "lu.11.11"],
    "externalUrl": "https://chemlaboratory.vercel.app/",
    "evidencePolicy": "none",
    "localAssessmentRequired": true
  },
  {
    "id": "ext.chemai.rate",
    "provider": "chemai",
    "mode": "deep-link",
    "status": "active",
    "title": "Reaction Rate — ChemAI",
    "description": "Prediction → experiment → observation oqimida reaksiya tezligiga ta’sir etuvchi omillarni tekshirish.",
    "learningUnitIds": ["lu.8.19", "lu.11.15", "lu.11.16"],
    "externalUrl": "https://chemai.in/virtual%20lab/ICSE/class10/Rate_of_Reaction_Lab.html",
    "evidencePolicy": "self_report",
    "localAssessmentRequired": true
  },
  {
    "id": "ext.chemai.equilibrium",
    "provider": "chemai",
    "mode": "deep-link",
    "status": "active",
    "title": "Chemical Equilibrium — ChemAI",
    "description": "Le Chatelier tamoyili, konsentratsiya va muvozanat siljishini qo‘shimcha virtual amaliyotda ko‘rish.",
    "learningUnitIds": ["lu.8.20", "lu.11.17", "lu.11.18"],
    "externalUrl": "https://chemai.in/virtual%20lab/index.html",
    "evidencePolicy": "self_report",
    "localAssessmentRequired": true
  },
  {
    "id": "ext.chemai.electrochem",
    "provider": "chemai",
    "mode": "deep-link",
    "status": "active",
    "title": "Electrochemistry — ChemAI",
    "description": "Elektroliz va elektrokimyoviy elementlar bo‘yicha qo‘shimcha virtual amaliyot.",
    "learningUnitIds": ["lu.9.15", "lu.11.21", "lu.11.22"],
    "externalUrl": "https://chemai.in/virtual%20lab/index.html",
    "evidencePolicy": "self_report",
    "localAssessmentRequired": true
  },
  {
    "id": "ext.chemai.separation",
    "provider": "chemai",
    "mode": "deep-link",
    "status": "active",
    "title": "Separation Techniques — ChemAI",
    "description": "Filtrlash, bug‘latish, kristallash va xromatografiya bo‘yicha qo‘shimcha virtual amaliyot.",
    "learningUnitIds": ["lu.7.03"],
    "externalUrl": "https://chemai.in/virtual%20lab/index.html",
    "evidencePolicy": "self_report",
    "localAssessmentRequired": true
  },
  {
    "id": "ext.chemai.corrosion",
    "provider": "chemai",
    "mode": "deep-link",
    "status": "active",
    "title": "Corrosion & Prevention — ChemAI",
    "description": "Metallar korroziyasi va himoya usullarini qo‘shimcha virtual tajribada ko‘rish.",
    "learningUnitIds": ["lu.9.14"],
    "externalUrl": "https://chemai.in/virtual%20lab/index.html",
    "evidencePolicy": "self_report",
    "localAssessmentRequired": true
  },
  {
    "id": "ext.chemai.organic-analysis",
    "provider": "chemai",
    "mode": "deep-link",
    "status": "active",
    "title": "Organic Functional Group Tests — ChemAI",
    "description": "Spirt, fenol, aldegid, keton va karbon kislotalar uchun sifat reaksiyalari.",
    "learningUnitIds": ["lu.10.17", "lu.10.18", "lu.10.19", "lu.10.21", "lu.10.22", "lu.10.23"],
    "externalUrl": "https://chemai.in/virtual%20lab/index.html",
    "evidencePolicy": "self_report",
    "localAssessmentRequired": true
  },
  {
    "id": "ext.nobook.inorganic",
    "provider": "nobook",
    "mode": "embed",
    "status": "requires_partner_access",
    "title": "NOBOOK — Inorganic Chemistry",
    "description": "NOBOOK inorganic chemistry modulini KimyoLab ichida iframe/SDK orqali ochish uchun tayyor adapter.",
    "learningUnitIds": ["lu.8.14", "lu.8.16", "lu.8.20", "lu.9.05", "lu.9.06", "lu.11.17", "lu.11.18", "lu.11.19", "lu.11.20"],
    "nobookModuleId": 9,
    "evidencePolicy": "scene_state",
    "localAssessmentRequired": true
  },
  {
    "id": "ext.nobook.organic",
    "provider": "nobook",
    "mode": "embed",
    "status": "requires_partner_access",
    "title": "NOBOOK — Organic Chemistry",
    "description": "NOBOOK organic chemistry modulini KimyoLab ichida ochish uchun tayyor adapter.",
    "learningUnitIds": ["lu.10.17", "lu.10.18", "lu.10.19", "lu.10.20", "lu.10.21", "lu.10.22", "lu.10.23"],
    "nobookModuleId": 10,
    "evidencePolicy": "scene_state",
    "localAssessmentRequired": true
  },
  {
    "id": "ext.nobook.electrochem",
    "provider": "nobook",
    "mode": "embed",
    "status": "requires_partner_access",
    "title": "NOBOOK — Electrochemistry",
    "description": "NOBOOK electrochemistry modulini KimyoLab ichida ochish uchun tayyor adapter.",
    "learningUnitIds": ["lu.9.15", "lu.11.21", "lu.11.22"],
    "nobookModuleId": 27,
    "evidencePolicy": "scene_state",
    "localAssessmentRequired": true
  }
]
